{
  "schema_version": "metric-registry/1",
  "metrics": [
    {
      "name": "ANFCI",
      "label": "Adjusted NFCI",
      "short": "ANFCI",
      "source": {
        "kind": "gold_series",
        "source": "econ",
        "id": "ANFCI",
        "units": "lin"
      },
      "data_class": "public_market_data",
      "unit": "index",
      "display_unit": "index",
      "unit_review": "catalog",
      "decimals": 2,
      "grain": "week",
      "agg": "mean",
      "additivity": "non_additive",
      "dimensions": [],
      "domains": [
        "economics_macro"
      ],
      "synonyms": [
        "adjusted nfci",
        "anfci"
      ],
      "owner": "gold:fred_latest_observation"
    },
    {
      "name": "AUSCPIALLQINMEI",
      "label": "Australia CPI Index",
      "short": "AU CPI",
      "source": {
        "kind": "gold_series",
        "source": "econ",
        "id": "AUSCPIALLQINMEI",
        "units": "lin"
      },
      "data_class": "public_market_data",
      "unit": "index",
      "display_unit": "index",
      "unit_review": "catalog",
      "decimals": 2,
      "grain": "quarter",
      "agg": "mean",
      "additivity": "non_additive",
      "dimensions": [],
      "domains": [
        "economics_macro"
      ],
      "synonyms": [
        "au cpi",
        "auscpiallqinmei",
        "australia cpi index"
      ],
      "owner": "gold:fred_latest_observation"
    },
    {
      "name": "AWHAETP",
      "label": "Avg Weekly Hours",
      "short": "Hours",
      "source": {
        "kind": "gold_series",
        "source": "econ",
        "id": "AWHAETP",
        "units": "lin"
      },
      "data_class": "public_market_data",
      "unit": "hours",
      "display_unit": "hrs",
      "unit_review": "catalog",
      "decimals": 1,
      "grain": "month",
      "agg": "mean",
      "additivity": "non_additive",
      "dimensions": [],
      "domains": [
        "economics_macro"
      ],
      "synonyms": [
        "avg weekly hours",
        "awhaetp",
        "hours"
      ],
      "owner": "gold:fred_latest_observation"
    },
    {
      "name": "BAMLC0A0CM",
      "label": "US IG Corp OAS",
      "short": "IG OAS",
      "source": {
        "kind": "gold_series",
        "source": "econ",
        "id": "BAMLC0A0CM",
        "units": "lin"
      },
      "data_class": "public_market_data",
      "unit": "pp",
      "display_unit": "pp",
      "unit_review": "reviewed",
      "decimals": 2,
      "grain": "day",
      "agg": "mean",
      "additivity": "non_additive",
      "dimensions": [],
      "domains": [
        "credit_markets"
      ],
      "synonyms": [
        "bamlc0a0cm",
        "ig oas",
        "ig spread",
        "investment grade spread",
        "us ig corp oas"
      ],
      "owner": "gold:fred_latest_observation"
    },
    {
      "name": "BAMLC0A0CMEY",
      "label": "US IG Corp Yield",
      "short": "IG Yield",
      "source": {
        "kind": "gold_series",
        "source": "econ",
        "id": "BAMLC0A0CMEY",
        "units": "lin"
      },
      "data_class": "public_market_data",
      "unit": "pct",
      "display_unit": "%",
      "unit_review": "catalog",
      "decimals": 2,
      "grain": "day",
      "agg": "mean",
      "additivity": "non_additive",
      "dimensions": [],
      "domains": [
        "credit_markets"
      ],
      "synonyms": [
        "bamlc0a0cmey",
        "ig yield",
        "us ig corp yield"
      ],
      "owner": "gold:fred_latest_observation"
    },
    {
      "name": "BAMLC0A1CAAA",
      "label": "AAA Corp OAS",
      "short": "AAA",
      "source": {
        "kind": "gold_series",
        "source": "econ",
        "id": "BAMLC0A1CAAA",
        "units": "lin"
      },
      "data_class": "public_market_data",
      "unit": "pp",
      "display_unit": "pp",
      "unit_review": "reviewed",
      "decimals": 2,
      "grain": "day",
      "agg": "mean",
      "additivity": "non_additive",
      "dimensions": [],
      "domains": [
        "credit_markets"
      ],
      "synonyms": [
        "aaa",
        "aaa corp oas",
        "bamlc0a1caaa"
      ],
      "owner": "gold:fred_latest_observation"
    },
    {
      "name": "BAMLC0A2CAA",
      "label": "AA Corp OAS",
      "short": "AA",
      "source": {
        "kind": "gold_series",
        "source": "econ",
        "id": "BAMLC0A2CAA",
        "units": "lin"
      },
      "data_class": "public_market_data",
      "unit": "pp",
      "display_unit": "pp",
      "unit_review": "reviewed",
      "decimals": 2,
      "grain": "day",
      "agg": "mean",
      "additivity": "non_additive",
      "dimensions": [],
      "domains": [
        "credit_markets"
      ],
      "synonyms": [
        "aa",
        "aa corp oas",
        "bamlc0a2caa"
      ],
      "owner": "gold:fred_latest_observation"
    },
    {
      "name": "BAMLC0A3CA",
      "label": "A Corp OAS",
      "short": "A",
      "source": {
        "kind": "gold_series",
        "source": "econ",
        "id": "BAMLC0A3CA",
        "units": "lin"
      },
      "data_class": "public_market_data",
      "unit": "pp",
      "display_unit": "pp",
      "unit_review": "reviewed",
      "decimals": 2,
      "grain": "day",
      "agg": "mean",
      "additivity": "non_additive",
      "dimensions": [],
      "domains": [
        "credit_markets"
      ],
      "synonyms": [
        "a",
        "a corp oas",
        "bamlc0a3ca"
      ],
      "owner": "gold:fred_latest_observation"
    },
    {
      "name": "BAMLC0A4CBBB",
      "label": "BBB Corp OAS",
      "short": "BBB",
      "source": {
        "kind": "gold_series",
        "source": "econ",
        "id": "BAMLC0A4CBBB",
        "units": "lin"
      },
      "data_class": "public_market_data",
      "unit": "pp",
      "display_unit": "pp",
      "unit_review": "reviewed",
      "decimals": 2,
      "grain": "day",
      "agg": "mean",
      "additivity": "non_additive",
      "dimensions": [],
      "domains": [
        "credit_markets"
      ],
      "synonyms": [
        "bamlc0a4cbbb",
        "bbb",
        "bbb corp oas"
      ],
      "owner": "gold:fred_latest_observation"
    },
    {
      "name": "BAMLEMCBPIOAS",
      "label": "EM Corp OAS",
      "short": "EM Corp",
      "source": {
        "kind": "gold_series",
        "source": "econ",
        "id": "BAMLEMCBPIOAS",
        "units": "lin"
      },
      "data_class": "public_market_data",
      "unit": "pp",
      "display_unit": "pp",
      "unit_review": "reviewed",
      "decimals": 2,
      "grain": "day",
      "agg": "mean",
      "additivity": "non_additive",
      "dimensions": [],
      "domains": [
        "credit_markets"
      ],
      "synonyms": [
        "bamlemcbpioas",
        "em corp",
        "em corp oas"
      ],
      "owner": "gold:fred_latest_observation"
    },
    {
      "name": "BAMLH0A0HYM2",
      "label": "HY Credit Spread (OAS)",
      "short": "HY OAS",
      "source": {
        "kind": "gold_series",
        "source": "econ",
        "id": "BAMLH0A0HYM2",
        "units": "lin"
      },
      "data_class": "public_market_data",
      "unit": "pp",
      "display_unit": "pp",
      "unit_review": "reviewed",
      "decimals": 2,
      "grain": "day",
      "agg": "mean",
      "additivity": "non_additive",
      "dimensions": [],
      "domains": [
        "credit_markets"
      ],
      "synonyms": [
        "bamlh0a0hym2",
        "high yield oas",
        "high yield spread",
        "hy credit spread (oas)",
        "hy oas",
        "hy spread"
      ],
      "owner": "gold:fred_latest_observation"
    },
    {
      "name": "BAMLH0A0HYM2EY",
      "label": "US HY Corp Yield",
      "short": "HY Yield",
      "source": {
        "kind": "gold_series",
        "source": "econ",
        "id": "BAMLH0A0HYM2EY",
        "units": "lin"
      },
      "data_class": "public_market_data",
      "unit": "pct",
      "display_unit": "%",
      "unit_review": "catalog",
      "decimals": 2,
      "grain": "day",
      "agg": "mean",
      "additivity": "non_additive",
      "dimensions": [],
      "domains": [
        "credit_markets"
      ],
      "synonyms": [
        "bamlh0a0hym2ey",
        "hy yield",
        "us hy corp yield"
      ],
      "owner": "gold:fred_latest_observation"
    },
    {
      "name": "BAMLH0A1HYBB",
      "label": "BB HY OAS",
      "short": "BB",
      "source": {
        "kind": "gold_series",
        "source": "econ",
        "id": "BAMLH0A1HYBB",
        "units": "lin"
      },
      "data_class": "public_market_data",
      "unit": "pp",
      "display_unit": "pp",
      "unit_review": "reviewed",
      "decimals": 2,
      "grain": "day",
      "agg": "mean",
      "additivity": "non_additive",
      "dimensions": [],
      "domains": [
        "credit_markets"
      ],
      "synonyms": [
        "bamlh0a1hybb",
        "bb",
        "bb hy oas"
      ],
      "owner": "gold:fred_latest_observation"
    },
    {
      "name": "BAMLH0A2HYB",
      "label": "B HY OAS",
      "short": "B",
      "source": {
        "kind": "gold_series",
        "source": "econ",
        "id": "BAMLH0A2HYB",
        "units": "lin"
      },
      "data_class": "public_market_data",
      "unit": "pp",
      "display_unit": "pp",
      "unit_review": "reviewed",
      "decimals": 2,
      "grain": "day",
      "agg": "mean",
      "additivity": "non_additive",
      "dimensions": [],
      "domains": [
        "credit_markets"
      ],
      "synonyms": [
        "b",
        "b hy oas",
        "bamlh0a2hyb"
      ],
      "owner": "gold:fred_latest_observation"
    },
    {
      "name": "BAMLH0A3HYC",
      "label": "CCC & Lower OAS",
      "short": "CCC",
      "source": {
        "kind": "gold_series",
        "source": "econ",
        "id": "BAMLH0A3HYC",
        "units": "lin"
      },
      "data_class": "public_market_data",
      "unit": "pp",
      "display_unit": "pp",
      "unit_review": "reviewed",
      "decimals": 2,